,Brand,Categorie,Description,Name,Photo,Price
46, Eleaf,e_cigarette,Le kit Lexicon 235W Eleaf ❤ est une immersion réussie dans l'univers du TFV like ★,Kit Lexicon 235W - Eleaf,https://www.evaps.fr/documents/media/images/contenu/kit-lexicon-eleaf.jpg,79.90
23, Vaporesso,e_cigarette,Vapotez en toute discrétion et avec style avec le Kit Tarot Baby Vaporesso ❤,Kit Tarot Baby - Vaporesso,https://www.evaps.fr/documents/media/images/contenu/kit-tarot-baby-vaporesso.jpg,67.90
338, Dude's,diy,L'arôme Strawberry Pancake Dude's 30ml ❤ est une explosion de saveurs gourmandes qui vous mettra sans nul doute l'eau à la bouche ✔,Strawberry Pancake - Dude's,https://www.evaps.fr/documents/media/images/contenu/strawberry-pancake-dude-s.jpg,13.90
243, Gold Leaf Liquids,e_liquide,Le e-eliquide Acapulco 80ml Gold Leaf par Gold Leaf Liquids ❤ mélange avec brio un arôme de tabac intense et une délicieuse vanille custard.,Acapulco - Gold Leaf Liquids,https://www.evaps.fr/documents/media/images/contenu/acapulco-gold-leaf-liquids.jpg,29.90
186, Five Pawns,e_liquide,Succombez aux saveurs enivrantes du e liquide Elo Tobacco Five Pawns ❤ subtil mélange de tabac accompagné de notes d'agrumes. Le eliquide Five Pawns Elo Tobacco 50ml ➤ est une merveilleuse recette tout droit venue des USA pour le plus grand plaisir des amateurs de saveurs de tabac.,Elo Tobacco 50ml - Five Pawns,https://www.evaps.fr/documents/media/images/contenu/elo-tobacco-50ml-five-pawns.jpg,24.90
335, Kendo,diy,"Le concentré Key Lime Mousse Kendo ❤ est une gourmandise surprenante et efficace : une mousse crémeuse, associée à un citron vert délicieusement acidulé, pour la fabrication d'un e-liquide original et addictif !",Arôme Key Lime Mousse - Kendo,https://www.evaps.fr/documents/media/images/contenu/arome-key-lime-mousse-kendo.jpg,13.50
44, Joyetech,e_cigarette,"Ayez du style avec la box Espion Infinite Joyetech ! Avec son design et ses performances digne d'un film de science fiction, elle ne passera pas inaperçue ❤.",Box Espion Infinite 230W - Joyetech,https://www.evaps.fr/documents/media/images/contenu/box-espion-infinite-joyetech.jpg,69.90
203, Les Déglingos,e_liquide,"Le Eliquide Happy Feet Les Déglingos ★ est une composition fruitée mélangeant un délicieux ananas, des pêches juteuses à souhait et une grenade bien rouge... Amateurs de fruités, vous avez peut-être là votre all-day !",Happy Feet 50ml - Les Déglingos,https://www.evaps.fr/documents/media/images/contenu/happy-feet-les-deglingos.jpg,21.90
192,liquide Menthocalyptus - So Fifty,e_liquide,Le Menthocalyptus So Fifty ❤ est une nouvelle version du e-liquide éponyme par Alfaliquid. ,E-liquide Menthocalyptus - So Fifty,https://www.evaps.fr/documents/media/images/contenu/menthocalyptus-10ml-so-fifty.jpg,5.90
233, Riot Squad,e_liquide,"Amateurs de gourmandises, ne passez pas à coté du e liquide Strawberry Scream Riot Squad ❤ cette délicieuse recette composée d'une fraise sucrée et juteuse s'associant à la perfection avec une crème onctueuse fera le bonheur de vos papilles.",Strawberry Scream 50ml - Riot Squad,https://www.evaps.fr/documents/media/images/contenu/strawberry-scream-riot-squad.jpg,19.90
307, La Casa De Vape,e_liquide,Armez votre clearomiseur du e liquide La Casa De Vape Tokyo ❤ pour un braquage de vos sens réussi !,Tokyo 50ml - La Casa De Vape,https://www.evaps.fr/documents/media/images/contenu/tokyo-la-casa-de-vape.jpg,24.90
17, Wismec,e_cigarette,Découvrez le kit Active Wismec ❤ la première cigarette électronique dotée d'une enceinte Bluetooth musicale.,Kit Active 80W - Wismec,https://www.evaps.fr/documents/media/images/contenu/kit-active-wismec.jpg,79.90
422, Fruit Punch,diy,Préparez vous à faire voyager vos papilles avec le ➤ Soursop strawberry grape !,Soursop Strawberry Grape - Fruit Punch,https://www.evaps.fr/documents/media/images/contenu/soursop-strawberry-grape-fruit-punch.jpg,6.90
153, Fruuits by Fuu,e_liquide,"L'e-liquide Framboise Fruuits by Fuu ✔ est un liquide aux sels de nicotine, au délicieux goût d'une framboise mûre, sucrée et gourmande à souhait.",Framboise - Fruuits by Fuu,https://www.evaps.fr/documents/media/images/contenu/framboise-fruuits-by-fuu.jpg,5.90
19, Hugo Vapor,e_cigarette,"Amateur de mods électroniques performants et stylés, la Box Hugo Vapor Rader Mage ★ est faite pour vous !",Box Rader Mage - Hugo Vapor,https://www.evaps.fr/documents/media/images/contenu/box-rader-mage-hugo-vapor.jpg,48.90
295,liquide Framboyz 50ml - Liquideo,e_liquide,"Le liquideo Framboyz 50ml ❤ est un délicieux mélange venu des sous bois, composé de fraise, de cassis et de framboise. Le eliquide Framboyz 50 ml et ses notes de fruits rouges feront rougir de plaisir vos papilles.",E-liquide Framboyz 50ml - Liquideo,https://www.evaps.fr/documents/media/images/contenu/e-liquide-framboyz-liquideo-50ml.jpg,19.90
305, Hyprtonic,e_liquide,Avis aux amateurs du délicieux et succulent e liquide Hyprtonic Cookie Explosion ❤ !,Cookie Explosion 50ml - Hyprtonic,https://www.evaps.fr/documents/media/images/contenu/cookie-explosion-hyprtonic-50ml.jpg,24.90
324, Readiy,diy,Le concentré Fraise Readiy ❤ est un arôme d'origine française pour la fabrication de liquide pour cigarette électronique. Cet arôme fraise est un vrai régal fruité et ensoleillé pour le plus grand bonheur des vapoteurs ! ,Arôme Fraise - Readiy,https://www.evaps.fr/documents/media/images/contenu/arome-fraise-readiy.jpg,3.50
31, Swedish Vaper,e_cigarette,"Désigné par la branche UK de la marque, le Kit Hive Squonk Dinky RDA Swedish Vaper ❤ vous surprendra par son look unique à l'allure d'une ruche !Ce kit mécanique bottom feed polyvalent vous permettra d'expérimenter une vape d'experts.",Kit Hive Squonk Dinky RDA - Swedish Vaper,https://www.evaps.fr/documents/media/images/contenu/kit-hive-squonk-dinky-rda.jpg,74.90
336, Kendo,diy,"Le concentré Butterscotch Custard Kendo ❤ est un bonheur de gourmandise : une délicieuse friandise au caramel, adoucie par une excellente vanille custard proche de la perfection.",Butterscotch Custard - Kendo,https://www.evaps.fr/documents/media/images/contenu/butterscotch-custard-kendo.jpg,13.50
154, Fruuits by Fuu,e_liquide,"L'e-liquide Citron Fruuits by Fuu ✔ est un liquide aux sels de nicotine, au délicieux goût d'un citron naturellement acidulé.",Citron - Fruuits by Fuu,https://www.evaps.fr/documents/media/images/contenu/citron-fruuits-by-fuu.jpg,5.90
106, Wismec,e_cigarette,,Coffret Predator 228 / Elabo - Wismec,https://www.evaps.fr/documents/media/images/contenu/predator-228-elabo-wismec.jpg,79.90
216, Sironade,e_liquide,Rafraîchissez vous avec le délicieux e liquide Orange Sironade ❤ un succulent e-liquide reproduisant à la perfection une limonade acidulée à l'orange.,Orange 60ml - Sironade,https://www.evaps.fr/documents/media/images/contenu/orange-sironade.jpg,24.90
29,601 - JustFog,e_cigarette,Découvrez le Pod JustFog C-601 ❤ ,Pod C-601 - JustFog,https://www.evaps.fr/documents/media/images/contenu/pod-c-601-justfog.jpg,19.90
272, Vape Or Diy,e_liquide,Régalez vous avec le succulent eliquide Projet Ame Ame Revolute ❤ une merveilleuse composition de vanille custard et de fraise saupoudrée de pétales de céréales pour le plaisir des vapoteurs gourmands.,Projet Ame Ame 10ml - Vape Or Diy,https://www.evaps.fr/documents/media/images/contenu/eliquide-projet-ame-ame-vape-or-diy.jpg,5.90
290,liquide Le M 50ml - Liquideo,e_liquide,"Laissez vous tenter par le Liquideo M 50ml ❤ . Son gout de tabac corsé et sec vous procurera de véritables sensations vaporesques. Inimitable, le eliquide M Liquideo 50 ml vous rappellera ➤ le classic tabac Mboro.",E-liquide Le M 50ml - Liquideo,https://www.evaps.fr/documents/media/images/contenu/eliquide-le-m-liquideo-50ml.jpg,19.90
168, Bee,e_liquide,L'eliquide Frutty Red Bee vous plonge dans un bonheur fruité intense avec un délicieux mélange de nombreux fruits rouges sucrés et acidulés. Laissez vous subjuguer par ce merveilleux e liquide français !Le Frutty Red Bee 10ml Solevan est fabriqué en France par la marque Solevan.,Frutty Red 10ml - Bee,https://www.evaps.fr/documents/media/images/contenu/frutty-red-10ml-bee.jpg,5.90
331, Horny Flava,diy,"Le Pomberry Horny Flava ❤ est la version concentrée du célèbre e-liquide malaisien du même nom. Avec le Pomberry, Horny Flava nous propose un mélange original et savoureusement exotique, à base de melon, mangoustan, et fraise, relevé par un effet de fraîcheur.",Concentré Pomberry - Horny Flava,https://www.evaps.fr/documents/media/images/contenu/concentre-pomberry-horny-flava.jpg,13.90
377, Diy Monster,diy,"Concoctez une recette surprenante et originale avec l'arôme Diy Monster Yellowster 10ml ❤ . Un véritable smoothie à la fraise et à la pastèque, également accompagné de fruits de la passion pour une expérience inoubliable.",Concentré Yellowster - Diy Monster,https://www.evaps.fr/documents/media/images/contenu/concentre-yellowster-diy-monster.jpg,5.50
141, Joyetech,e_cigarette,,Batterie eGo One V2 XL (2200 mAh) - Joyetech,https://www.evaps.fr/documents/media/images/contenu/batterie-ego-one-v2-xl-2200-mah-joyetech.jpg,23.90
138, Joyetech,e_cigarette,,Kit eGo One Mega V2 - Joyetech,https://www.evaps.fr/documents/media/images/contenu/kit-ego-one-mega-v2-joyetech.jpg,42.90
122, Joyetech,e_cigarette,,Kit Unimax 25 - Joyetech,https://www.evaps.fr/documents/media/images/contenu/kit-unimax-25-joyetech.jpg,49.90
236, Riot Squad,e_liquide,Rafraîchissez vous avec le e liquide Cola Cooler Riot Squad ❤ Parfaite reproduction du célèbre soda avec un effet fresh surprenant qui scotchera vos papilles.,Cola Cooler 50ml - Riot Squad,https://www.evaps.fr/documents/media/images/contenu/cola-cooler-riot-squad.jpg,19.90
415, DIY Freaks,diy,La Base 50 50 Diy Freaks © est un Pack DIY 50/50 200ml vous permettant d'obtenir votre base nicotinée sans aucun calcul ❤.,Pack base 50 50 200ml - DIY Freaks,https://www.evaps.fr/documents/media/images/contenu/pack-diy-freaks-50-50-200ml.jpg,9.90
294,liquide Gary Guet 50ml - Liquideo,e_liquide,"Le Liquideo Gary Guet 50ml ❤ et sa saveur de fraise des bois bluffera vos papilles par son réalisme. Parfait pour les amateurs de fruits rouges, le e-liquide Gary Guet Liquideo 50 ml fera un parfait compagnon dans votre clearomiseur.",E-liquide Gary Guet 50ml - Liquideo,https://www.evaps.fr/documents/media/images/contenu/eliquide-gary-guet-liquideo-50ml.jpg,19.90
175, Bio France,e_liquide,L'eliquide Sur le Mékong French Malaisien ✔ est un e-liquide bio citron français qui provoquera une explosion de saveurs citronnées et d'autres agrumes en une seule bouffée. Cette création fruitée de la gamme French Malaisien est fabriquée en France par la marque Bio France.,Sur le Mékong French Malaisien - Bio France,https://www.evaps.fr/documents/media/images/contenu/sur-le-mekong-french-malaisien-bio-france.jpg,5.50
37, Smoktech,e_cigarette,Découvrez le kit Smok Stick Resa ❤ Un kit Smoktech pour l'inhalation directe et ultra simple d'utilisation ✓,Kit Stick Resa - Smoktech,https://www.evaps.fr/documents/media/images/contenu/kit-stick-resa-smoktech.jpg,42.90
451, Readiy,diy,Faites bouger vos papilles avec l'arôme Energy Drink de Readiy !,Arôme Energy Drink - Readiy,https://www.evaps.fr/documents/media/images/contenu/arome-energy-drink-readiy.jpg,3.50
352, Halo,diy,"Le Booster sel de nicotine Fusion Halo ❤ sera le e liquide parfait pour les amateurs de recettes DIY, en vue d'une vape en inhalation indirecte ainsi que sur Pod électronique ✔",Booster Fusion Sel de Nicotine - Halo,https://www.evaps.fr/documents/media/images/contenu/booster-sel-de-nicotine-fusion-halo.jpg,2.40
50, Joyetech,e_cigarette,"Avec le Kit Espion Infinite 230W Joyetech ❤, découvrez l'accord parfait entre ▶ design et ▶ technologie.",Kit Espion Infinite - Joyetech,https://www.evaps.fr/documents/media/images/contenu/kit-espion-infinite-joyetech.jpg,96.90
7, Voopoo,e_cigarette,"La marque américaine Voopoo Vape continue sa percée dans l'univers des cigarettes électroniques de type Pod et nous propose le Pod VFL Voopoo ★. Le Kit Pod VFL est doté de plusieurs nouveautés, avec notamment un nouveau système d'airflow et du voltage variable, afin d'ajuster au mieux les sensations de vape selon vos préférences.",Kit Pod VFL - Voopoo,https://www.evaps.fr/documents/media/images/contenu/kit-pod-vfl-voopoo.jpg,26.90
262, Ko Punch,e_liquide,"Le eliquide Ko Punch Grape Punch ❤ est un succulent e-liquide saveur raisin, frais et rafraîchissant. Il donnera un coup poignant à votre clearomiseur pour vous apporter des saveurs exceptionnellement délicieuses.",Grape Punch 80ml - Ko Punch,https://www.evaps.fr/documents/media/images/contenu/grape-punch-ko-punch.jpg,24.90
245, Vapempire,e_liquide,"Le Vape Empire Mango Blackcurrant ❤ est un savant mélange d’une mangue tropicale bien mûre et de cassis, avec une pointe de fraîcheur.",Mango Blackcurrant - Vapempire,https://www.evaps.fr/documents/media/images/contenu/mango-blackcurrant-vapempire.jpg,5.90
226, Petit Nuage,e_liquide,"La Petite Limo ❤ e liquide Petit Nuage vape, est une délicieuse recette rafraîchissante aux touches d'agrumes que vous allez adorer ✔",La Petite Limo 60ml - Petit Nuage,https://www.evaps.fr/documents/media/images/contenu/la-petite-limo-petit-nuage.jpg,24.90
442, Cloud Vapor,diy,Fabriquez votre e liquide DIY avec l'arôme Moabi signé Cloud Vapor ©.,Concentré Moabi - Cloud Vapor,https://www.evaps.fr/documents/media/images/contenu/concentre-moabi-cloud-vapor.jpg,6.90
8, Wismec,e_cigarette,Optez pour la puissance et la praticité avec le kit Luxotic DF Wismec ❤,Kit Luxotic DF - Wismec,https://www.evaps.fr/documents/media/images/contenu/kit-luxotic-df-wismec.jpg,84.90
220, Vaporigins Galaxy,e_liquide,"Lors d'une escale sur Titan, la fameuse lune de Saturne, les explorateurs français de Vape 47 découvrirent, à côté de divers modules spatiaux abandonnés, un eliquide gourmand laissé par une ancienne civilisation extra-terrestre.",Titan 50ml - Vaporigins Galaxy,https://www.evaps.fr/documents/media/images/contenu/titan-vaporigins.jpg,18.90
181, Cloud Vapor,e_liquide,"L'e liquide Red Leaf Cloud Vapor ✔ est un liquide tabac de grande qualité, ayant pour objectif une restitution réaliste du goût du tabac et de sa fumée.",Red Leaf 10ml - Cloud Vapor,https://www.evaps.fr/documents/media/images/contenu/e-liquide-red-leaf-10ml-cloud-vapor.jpg,6.50
184, Five Pawns,e_liquide,"Laissez vous tenter par le délicieux e liquide Kingside Five Pawns ❤ une incroyable mixture composée de tabac, de houblon et de fruits rouges qui combleront vos papilles de plaisir. Le eliquide kingside 50ml ZHC ➤ nous vient tout droit des USA pour le plus grand bonheur des amateurs de saveurs tabac.",Kingside Tobacco 50ml - Five Pawns,https://www.evaps.fr/documents/media/images/contenu/kingside-tobacco-50ml-five-pawns.jpg,24.90
431, Weedeo,diy,"Avec le booster CBD Weedeo, faire son e liquide DIY au CBD n'a jamais été aussi simple ❤",Booster CBD - Weedeo,https://www.evaps.fr/documents/media/images/contenu/booster-cbd-weedeo.jpg,19.95
266, Eliquid France,e_liquide,"Le succulent e liquide Suprême 100ml Eliquid France ❤ est maintenant disponible en grand format ! Redécouvrez ses délicieuses saveurs de tabac mélangé à des notes gourmandes de vanille, cookie et de noix de coco.",Suprême 100ml - Eliquid France,https://www.evaps.fr/documents/media/images/contenu/supreme-eliquid-france-100ml.jpg,29.90
160, Bee,e_liquide,"L'eliquide Minty Givré Bee va vous faire frissonner de plaisir avec sa menthe glaciale givrée ! Cet e-liquide français vous propose de vaper une menthe très, très fraîche.",Minty Givré 10ml - Bee,https://www.evaps.fr/documents/media/images/contenu/minty-givre-10ml-bee.jpg,5.90
193,liquide Menthe Glaciale - So Fifty,e_liquide,Le Menthe Glaciale So Fifty ❤ est une nouvelle version du e-liquide du même nom fabriqué par Alfaliquid.,E-liquide Menthe Glaciale - So Fifty,https://www.evaps.fr/documents/media/images/contenu/menthe-glaciale-10ml-so-fifty.jpg,5.90
51, Ijoy,e_cigarette,Le kit Avenger Ijoy ❤ va vous transformer en membre à part entière de l'équipe des Avengers avec ses ▶ commandes vocales intégrées ✔,Kit Avenger 270 - Ijoy,https://www.evaps.fr/documents/media/images/contenu/kit-avenger-270-ijoy.jpg,89.90
16, Aspire,e_cigarette,"Après le Spryte et le Breeze, Aspire continue sa percée dans l'univers des pods et nous propose le Kit Pod Nautilus AiO Aspire ★ Ce kit e-cigarette inhalation indirecte remet au goût du jour les sensations procurées par le clearomiseur Nautilus et ses résistances Nautilus BVC, plébiscités par les vapoteurs d'il y a quelques années.",Kit Pod Nautilus AiO - Aspire,https://www.evaps.fr/documents/media/images/contenu/kit-pod-nautilus-aio-aspire.jpg,32.90
273, Cloud Vapor,e_liquide,"Le e liquide Cloud Vapor Flying Sheep ➤ va surprendre vos sens avec ses notes de pommes accompagnées de grenade, une véritable explosion de vitamines dans votre clearomiseur. ",Flying Sheep 40/50ml - Cloud Vapor,https://www.evaps.fr/documents/media/images/contenu/flying-sheep-cloud-vapor-40-50ml.jpg,23.90
76, GeekVape,e_cigarette,"Avec le Kit Gbox Squonker 200W, GeekVape s'attaque avec brio à révolutionner le Bottom Feed ❤",Kit Gbox Squonker BF 200W - GeekVape,https://www.evaps.fr/documents/media/images/contenu/kit-gbox-bf-geekvape.jpg,78.90
83, Joyetech,e_cigarette,Laissez vous séduire par le kit Evic Primo Mini 80W + Procore Aries de chez Joyetech.,Kit Evic Primo Mini 80W / Procore Aries - Joyetech,https://www.evaps.fr/documents/media/images/contenu/kit-evic-primo-mini-procore-aries-joyetech.jpg,65.90
144,3 50ml - Tasty,e_liquide,"Le Tasty 49-3 ✔ est un e-liquide francais tabac gourmand 50ml, vous permettant d'apprécier un délicieux tabac accompagné de gourmandises telles que des noix de pécan et une crème vanillée.",49-3 50ml - Tasty,https://www.evaps.fr/documents/media/images/contenu/49-3-50ml-tasty.jpg,19.90
292,liquide Jolie Blonde 50ml - Liquideo,e_liquide,"Retrouvez une vape authentique avec le Liquideo Jolie Blonde 50ml ❤ et son parfum de tabac blond. Idéal en allday,  le eliquide tabac Jolie Blonde vous apportera ➤ toutes les saveurs d'un tabac classic blond sec et légèrement corsé.",E-liquide Jolie Blonde 50ml - Liquideo,https://www.evaps.fr/documents/media/images/contenu/eliquide-jolie-blonde-50ml-liquideo-50ml.jpg,19.90
349, Dude's,diy,Avec le concentré Banana Pineapple Dude's 30ml ❤ profitez d'un arôme hautement fruité pour vos recettes d'eliquide DIY ✔,Banana Pineapple - Dude's,https://www.evaps.fr/documents/media/images/contenu/banana-pineapple-dudes.jpg,13.90
219, Sironade,e_liquide,Succombez au e liquide Pomme Sironade ❤ une surprenante limonade aromatisée avec une pomme acidulée et sucrée qui enivrera vos papilles gourmandes.,Pomme 60ml - Sironade,https://www.evaps.fr/documents/media/images/contenu/pomme-60ml-sironade.jpg,24.90
278, Swag Juice,e_liquide,Le e liquide Swag Juice OD Séries N°1 ❤ est une parfaite combinaison liant une tarte aux pommes façon crumble à un tabac blond de caractère.,OD Séries N°1 50ml - Swag Juice,https://www.evaps.fr/documents/media/images/contenu/od-series-n1-swag-juice-50ml.jpg,16.90
380, Diy Monster,diy,Vos papilles vont virer au rouge avec l'arôme Diy Monster Redster 10ml ❤,Concentré Redster - Diy Monster,https://www.evaps.fr/documents/media/images/contenu/concentre-redster-diy-monster.jpg,5.50
318, Greeneo,diy,Boostez vos eliquides ou vos recettes DIY avec le booster CBD Greeneo Skuf ❤ ,Booster Skuff Full Spectrum - Greeneo,https://www.evaps.fr/documents/media/images/contenu/booster-skuff-greeneo.jpg,49.90
309, La Casa De Vape,e_liquide,"Gardez la forme avec le e liquide français La Casa De Vape Nairobi ❤, un concentré d'énergie reproduisant la célèbre boisson énergisante à la taurine.",Nairobi 50ml - La Casa De Vape,https://www.evaps.fr/documents/media/images/contenu/nairobi-la-casa-de-vape.jpg,24.90
218, Vaporigins,e_liquide,"Le Vaporigins Fury Berry ✔ est un e-liquide original, fruité et gourmand. L'e liquide Fury Berry vous permettra de vaper une délicieuse confiture de fruits rouges, sublimée par une note vanillée gourmande à souhait.",Fury Berry 80ml - Vaporigins,https://www.evaps.fr/documents/media/images/contenu/fury-berry-vaporigins.jpg,25.00
34, Vaporesso,e_cigarette,"Le Kit Polar 220W Vaporesso ❤ est l'alliance parfaite entre une box ▶ à la pointe de la technologie, et un design tant qualitatif que soigné.",Kit Polar - Vaporesso,https://www.evaps.fr/documents/media/images/contenu/kit-polar-vaporesso.jpg,83.90
416, Mama Kitchen,diy,Fabriquez votre e liquide gourmand avec l'arôme Churros Chocolate Mama Kitchen © !,Concentré Churros Chocolate - Mama Kitchen,https://www.evaps.fr/documents/media/images/contenu/arome-churros-chocolate-mama-kitchen.jpg,6.90
268, One Hit Wonder,e_liquide,Préparez vos papilles à recevoir de la gourmandise fruitée avec e liquide The Man 50ml One Hit Wonder ❤.,The Man 50ml - One Hit Wonder,https://www.evaps.fr/documents/media/images/contenu/the-man-one-hit-wonder-50ml.jpg,22.90
397, Tropika,diy,"Découvrez le concentré Phuket Tropika ❤, un subtil mélange de raisin et de fraise pour une vape fruitée qui transportera vos papilles sur un nuage de saveurs douces et agréables.",Arôme Phuket 10ml - Tropika,https://www.evaps.fr/documents/media/images/contenu/arome-phuket-tropika.jpg,5.90
252, Illuminati Vapor,e_liquide,Offrez vous un petit plaisir avec le e liquide Money 100ml Illuminati Vapor ❤ Délicieuse recette reproduisant à merveille une boule de glace à la fraise qui fera frémir vos papilles gourmandes. ,Money 100ml - Illuminati Vapor,https://www.evaps.fr/documents/media/images/contenu/money-100ml-illuminati-vapor.jpg,27.90
229,liquide Balloon - Liquideo,e_liquide,"Faîtes rebondir vos papilles avec le eliquide Balloon Liquideo ❤ un succulent mélange de fruits rouges retranscrivant les douces et délicieuses saveurs de fraise, de mûre, de framboise et de cerise pour un mix surprenant et terriblement fruité.",E-liquide Balloon - Liquideo,https://www.evaps.fr/documents/media/images/contenu/e-liquide-balloon-liquideo.jpg,4.90
21, Eleaf,e_cigarette,"Succombez à l'ingéniosité et à l'efficacité incontestable du kit Pod iWu d'Eleaf ❤ Ergonomique et revêtu d'une armure ultra design, ce pod électronique pourra vous suivre partout ✔",Kit Pod iWu - Eleaf,https://www.evaps.fr/documents/media/images/contenu/pod-iwu-eleaf.jpg,28.90
13, Smoktech,e_cigarette,Le Kit Priv M17 Smok ❤ est un kit de cigarette électronique simple et efficace.,Kit Priv M17 - Smoktech,https://www.evaps.fr/documents/media/images/contenu/kit-priv-m17-smok.jpg,39.90
11, Smoktech,e_cigarette,"Avec son Kit Species Smok ★, Smoktech propose une machine de guerre surpuissante au design futuriste qui ne laissera personne indifférent.Pensé pour une vape subohm de qualité, le Kit Species TFV8 Baby V2 Smoktech vient avec la nouvelle version du clearomiseur TFV8 Baby et de nouvelles résistances Smoktech A.Il suffit d'un rapide test du Smok Species pour comprendre que ce kit est d'une efficacité redoutable !",Kit Species 230W - Smoktech,https://www.evaps.fr/documents/media/images/contenu/kit-species-smok.jpg,74.90
231, Riot Squad,e_liquide,"Préparez vous pour un voyage exotique avec le e liquide Tropical Fury Riot Squad ❤ savante composition de divers fruits exotiques, mélangés à de subtiles notes d'agrumes divers et variés.",Tropical Fury 50ml - Riot Squad,https://www.evaps.fr/documents/media/images/contenu/tropical-fury-riot-squad.jpg,19.90
80, Smoktech,e_cigarette,Dégainez votre Kit Mag 225W armé du TFV12 Prince de Smoktech.,Kit Mag 225W - Smoktech,https://www.evaps.fr/documents/media/images/contenu/kit-mag-smoktech-225w.jpg,79.90
286, Aloe Veritas Juice,e_liquide,Le e-liquide Aloe Veritas  par Aloe Veritas Juice ❤ surprendra vos sens par son originalité : une base d'Aloe Vera accompagné d'un mix complexe de différents fruits exotiques.,Aloe Veritas 50ml - Aloe Veritas Juice,https://www.evaps.fr/documents/media/images/contenu/eliquide-aloe-veritas.jpg,19.90
135, Joyetech,e_cigarette,,Kit eVic VTwo Mini Cubis Pro - Joyetech,https://www.evaps.fr/documents/media/images/contenu/kit-evic-vtwo-mini-cubis-pro-joyetech.jpg,65.90
178, Cloud Vapor,e_liquide,"L'e liquide Punch Berries Cloud Vapor ✔ est une création fruitée de grande qualité, alliant avec harmonie un smoothie fraise pastèque et de savoureux morceaux de mûres.",Punch Berries 10ml - Cloud Vapor,https://www.evaps.fr/documents/media/images/contenu/punch-berries-10ml-cloud-vapor.jpg,6.50
308, La Casa De Vape,e_liquide,"Le e liquide Rio 30/70 La Casa De Vape ❤ vous donnera du tonus pour rester alerte au moindre imprévu. Avec son citron vert rafraîchissant, le e-liquide Rio ZHC ➤ fera de vous les yeux et les oreilles de l'équipe.",Rio 50ml - La Casa De Vape,https://www.evaps.fr/documents/media/images/contenu/rio-la-casa-de-vape.jpg,24.90
30, Joyetech,e_cigarette,"Amateurs de sensations fortes, découvrez le dernier Kit Joyetech Espion Silk ❤ un pack complet de cigarette électronique composé de la box espion silk 80w + notchcore atomizer ✔ un duo pratique, puissant et confortable, conçu pour les vapoteurs de plein air !",Kit Espion Silk Notchcore - Joyetech,https://www.evaps.fr/documents/media/images/contenu/kit-espion-silk-joyetech.jpg,74.90
