,Brand,Categorie,Description,Name,Photo,Price
102, CoilArt,e_cigarette,,Kit Mage Mech Tricker - CoilArt,https://www.evaps.fr/documents/media/images/contenu/kit-mage-mech-tricker-coilart.jpg,69.90
77,Priv 230W - Smoktech,e_cigarette,Laissez place à la somptueuse Box S Priv de Smoktech !,Box S-Priv 230W - Smoktech,https://www.evaps.fr/documents/media/images/contenu/box-s-priv-smoktech-230w.jpg,56.90
82, Vaporesso,e_cigarette,Succombez au redoutable charme du kit Switcher de Vaporesso.,Kit Switcher 220W - Vaporesso,https://www.evaps.fr/documents/media/images/contenu/kit-switcher-vaporesso-220w.jpg,79.90
250, Petit Nuage,e_liquide,Le eliquide Flocon Pressé Petit Nuage 60ml ❤ est un doux rappel des saveurs de notre enfance ▶ sucrées et fruitées.,Flocon Pressé 60ml - Petit Nuage,https://www.evaps.fr/documents/media/images/contenu/flocon-presse-petit-nuage.jpg,24.90
109, Eleaf,e_cigarette,,Ikonn Total / Ello Mini XL - Eleaf,https://www.evaps.fr/documents/media/images/contenu/ikonn-total-ello-mini-xl-eleaf.jpg,43.90
303, Full Moon,e_liquide,"Voyagez avec le e-liquide Full Moon Red ❤ : un savant mélange de mangue et d'ananas, parsemé de fruits rouges.",E liquide Red 50ml - Full Moon,https://www.evaps.fr/documents/media/images/contenu/e-liquide-red-full-moon-50ml.jpg,19.90
239, Aqua,e_liquide,"Rafraîchissez vos papilles avec le e liquide Mist Ice Aqua ❤ ce succulent et savant mélange de pomme associé à de la pêche et du kiwi, le tout rehaussé par un menthol frais et intense. ",Mist Ice 50ml - Aqua,https://www.evaps.fr/documents/media/images/contenu/mist-ice-50ml-aqua.jpg,19.90
41, Joyetech,e_cigarette,Le Kit Evic Primo Fit Joyetech ❤ est le coffret de cigarette électronique format box idéal ✔ pour les primo-vapoteurs en quête d'un ▶ kit compact et ▶ évolutif.,Kit Evic Primo Fit 80W - Joyetech,https://www.evaps.fr/documents/media/images/contenu/kit-evic-primo-fit-joyetech.jpg,68.90
402, Swag Juice,diy,Retombez en enfance avec l'arôme Macaque Fruit Gummy Swag Juice Remix ❤,Concentré Macaque 10ml - Swag Juice,https://www.evaps.fr/documents/media/images/contenu/concentre-macaque-swag-juice.jpg,5.90
2, Modefined Lost Vape ,e_cigarette,"Issue de la collaboration entre les deux marques Modefined et Lost Vape, la Draco 200W Modefined ★ est une box combinant puissance, fiabilité et look ravageur. Difficile en effet de passer inaperçu avec la Draco 200W TC Lost Vape ! Son design rappelant un outil de contrôle futuriste est très réussi et plaira à de nombreux vapoteurs.",Draco 200W - Modefined Lost Vape ,https://www.evaps.fr/documents/media/images/contenu/modefined-draco-tc-200w-lost-vape.jpg,59.90
427, Halo White label,diy,"Votre arôme DIY Halo préféré doit avoir les saveurs d'un délicieux tabac classique Turque ? Alors n'hésitez plus, l'arôme Black Diamond Halo White Label est fait pour vous ! ❤",Arôme Black Diamond - Halo White label,https://www.evaps.fr/documents/media/images/contenu/black-diamond-halo-arome-white-label.jpg,4.90
6, Justfog,e_cigarette,Le P16A Kit VV Justfog ★ est un kit de cigarette électronique simple et efficace.,Kit P16A - Justfog,https://www.evaps.fr/documents/media/images/contenu/kit-p16a-justfog.jpg,25.90
107, Wismec,e_cigarette,,Box Sinuous P80 - Wismec,https://www.evaps.fr/documents/media/images/contenu/box-sinuous-p80-wismec.jpg,42.90
199, Danger Swoke,e_liquide,Attention à sa piqûre ❤ le e liquide français Mosquito Danger de Swoke 50ml ne cessera de vous démanger ✔,Mosquito - Danger Swoke,https://www.evaps.fr/documents/media/images/contenu/e-liquide-mosquito-swoke.jpg,24.90
432, Hold Up,diy,Cambriolez vos sens avec le Jack Pot de la gamme d'arômes concentrés Hold Up ©. Une gamme développée par Bordo2 qui saura prendre vos papilles en otage.,Concentré Jack Pot - Hold Up,https://www.evaps.fr/documents/media/images/contenu/concentre-jack-pot-hold-up.jpg,5.90
312, Vape Palace,diy,L'arôme Room 439 Vape Palace ❤ va faire fondre de plaisir vos sens. Sa recette de vanille custard onctueuse et savoureuse va faire baver plus d'un vapoteur gourmand.,Room 439 30ml - Vape Palace,https://www.evaps.fr/documents/media/images/contenu/room-439-30ml-vape-palace.jpg,13.90
61, Vaptio,e_cigarette,"Si pour vous un kit e cigarette puissant implique de grandes responsabilités, alors faites confiance au kit Wall Crawler 80W de Vaptio ❤",Kit Wall Crawler 80W - Vaptio,https://www.evaps.fr/documents/media/images/contenu/kit-wall-crawler-vaptio.jpg,59.90
115, Vaporesso,e_cigarette,,Kit Veco One Plus - Vaporesso,https://www.evaps.fr/documents/media/images/contenu/kit-veco-one-plus-vaporesso.jpg,42.90
36, Eleaf,e_cigarette,Trouvez ici la splendide box Eleaf Istick Pico S au meilleur prix ❤,Box Istick Pico S - Eleaf,https://www.evaps.fr/documents/media/images/contenu/box-istick-pico-s-eleaf.jpg,44.90
116,Think Vape ,e_cigarette,,Finder CT DNA250 -Think Vape ,https://www.evaps.fr/documents/media/images/contenu/finder-ct-dna250-think-vape.jpg,109.90
223, Vaporigins Galaxy,e_liquide,"Allo Houston ? Ici la planète Terre. On nous signale l’atterrissage de l'Apollo Vaporigins Galaxy ➤, un e-liquide français 50 ml qui risque de faire de gros dégâts d'addiction sur la population vapoteuse accro aux eliquides à la pomme.Les français de Vape 47 sont allés chercher les trois meilleurs arômes de pomme existant dans l'univers pour nous proposer l'Apollo, un eliquide interstellaire à base d'un trio de pommes.",Apollo 50ml - Vaporigins Galaxy,https://www.evaps.fr/documents/media/images/contenu/apollo-vaporigins.jpg,18.90
452, Readiy,diy,Succombez à l'arôme Pastèque de Readiy ©!,Arôme Pastèque - Readiy,https://www.evaps.fr/documents/media/images/contenu/arome-pasteque-readiy.jpg,3.50
258, Naked 100,e_liquide,"Le e-liquide Hawaiian Pog Ice 50ml ❤ annonce un voyage idyllique, entre une vapeur délicieusement fruitée et une fraîcheur explosive ✔",Hawaiian Pog Ice 50ml - Naked 100,https://www.evaps.fr/documents/media/images/contenu/hawaiian-pog-ice-naked.jpg,24.90
182, Jimmy The Juice Man,e_liquide,"Savourez le délicieux e liquide Crème Brûlée Jimmy The Juice Man ❤. Ce e-liquide Mix & Vape USA ✔ et ses saveurs originales de crème brûlée à souhait, ses notes de sucre roux et de caramel fondu sur une onctueuse vanille custard sur lesquelles s'ajoute une note subtile de banane flambée fera chavirer les papilles des vapoteurs gourmands.",Crème brûlée 50ml - Jimmy The Juice Man,https://www.evaps.fr/documents/media/images/contenu/creme-brulee-jimmy-the-juice-man.jpg,24.90
227, Greeneo,e_liquide,Vivez de nouvelles sensations avec le  e liquide CBD OG Kush Greeneo ❤ ,OG kush CBD - Greeneo,https://www.evaps.fr/documents/media/images/contenu/og-kush-cbd-greeneo.jpg,15.90
425, Halo White label,diy,La complexité parfaitement dosée du concentré Whisper White Label ne laissera pas de marbre les vapoteurs amateurs de saveurs recherchées ❤,Arôme Whisper - Halo White label,https://www.evaps.fr/documents/media/images/contenu/whisper-halo-arome-white-label.jpg,4.90
419, Full Milk,diy,"Full Moon © vous présente la version gourmande de l'arôme Blue, le Blue Full Milk !",Blue - Full Milk,https://www.evaps.fr/documents/media/images/contenu/blue-full-milk.jpg,5.90
224, Furiosa Vapor,e_liquide,L'e liquide Furiosa Ice Beam 40ml ❤ vous offrira sans aucune concession une explosion sauvage de force et de fraîcheur ✔,Ice Beam 40ml - Furiosa Vapor,https://www.evaps.fr/documents/media/images/contenu/ice-beam-40ml-furiosa.jpg,20.00
340, Dude's,diy,"Le concentré Peach Raspberry Dudes 30ml ❤ sera l'arôme idéal pour les vapoteurs hésitant entre fruit doux et plus acidulé, aucun compromis ✔",Peach Raspberry - Dude's,https://www.evaps.fr/documents/media/images/contenu/peach-raspberry-dude-s.jpg,13.90
444, Readiy,diy,Sucrez vos recettes DIY et eliquides avec l'additif Diy E liquid sweetener ✔,Additif Sweetener - Readiy,https://www.evaps.fr/documents/media/images/contenu/additif-sweetener-readiy.jpg,3.50
453, Readiy,diy,Confectionnez votre e-liquide DIY gourmand avec l'arôme Beignet de Readiy !,Arôme Beignet - Readiy,https://www.evaps.fr/documents/media/images/contenu/arome-beignet-readiy.jpg,2.80
283, Flawless,e_liquide,Rafraîchissez vos papilles avec le eliquide Flawless Lemon Ice Frozen ✔ une délicieuse limonade faite de citron et de menthe rafraîchissante.,Lemon Ice Frozen 100ml - Flawless,https://www.evaps.fr/documents/media/images/contenu/lemon-ice-frozen-flawless.jpg,27.90
47, Smoktech,e_cigarette,"Craquez pour le Smok Mag Baby Kit ❤. Petit et pratique, le Kit Mag Baby 50W Smoktech est d'excellente qualité et vous apportera une très bonne expérience de vape en petit format.",Kit Mag Baby 50W - Smoktech,https://www.evaps.fr/documents/media/images/contenu/kit-mag-baby-smoktech.jpg,67.90
176, Bio France,e_liquide,"L'eliquide Mandarin Subtil French Malaisien ✔ est un e-liquide bio et français, au délicieux goût d'une boisson à l'orange pétillante et rafraîchissante.Cette création fruitée de la gamme French Malaisien est fabriquée en France par la marque Bio France.",Mandarin Subtil French Malaisien - Bio France,https://www.evaps.fr/documents/media/images/contenu/mandarin-subtil-french-malaisien-bio-france.jpg,5.50
437, Ultimate,diy,Apportez de la douceur dans votre clearomiseur avec le Bahamut signé Ultimate ©.,Concentré Bahamut 30 ml - Ultimate,https://www.evaps.fr/documents/media/images/contenu/bahamut-ultimate.jpg,13.90
388, Fonta Flava,diy,"Le concentré Fonta Flava Grape ❤ est ce qu'il se fait de mieux en arôme malaisien ▶ Frais et ▶ fruité, redécouvrez les saveurs d'un raisin sucré, habilement concocté par la marque 77 Flavor ©",Arôme Grape - Fonta Flava,https://www.evaps.fr/documents/media/images/contenu/arome-grape-fonta-flava.jpg,5.90
392, Fonta Flava,diy,Redécouvrez la sensation d'une boisson à l'orange ▶ rafraîchissante et ▶ pétillante dans l'arôme concentré Fonta Flava Orange ❤,Arôme Orange - Fonta Flava,https://www.evaps.fr/documents/media/images/contenu/arome-orange-fonta-flava.jpg,5.90
267, Bubble Monster,e_liquide,"Rafraîchissez vous avec le e-liquide Vimto Bubble Monster ❤, savant mélange de raisin juteux et de bubble gum bien sucré.",Vimto 100ml - Bubble Monster,https://www.evaps.fr/documents/media/images/contenu/vimto-bubble-monster.jpg,29.90
385, Diy Monster,diy,"Régalez vos papilles avec l'arôme Diy Monster Orangester 10ml ❤ : délicieuse et gourmande pêche jaune, enrobée de crème fouettée sucrée.",Concentré Orangester - Diy Monster,https://www.evaps.fr/documents/media/images/contenu/concentre-orangester-diy-monster.jpg,5.50
390, Maori,diy,"Osez de nouvelles saveurs avec l'arôme Maori Fai Full Moon ❤, une recette délicieusement originale, composée d'un thé vert glacé accompagné de feuilles d'hibiscus, pour un résultat étonnant et rafraîchissant.",Concentré Fai - Maori,https://www.evaps.fr/documents/media/images/contenu/concentre-fai-maori.jpg,5.90
289,liquide Po Po Pom 50ml - Liquideo,e_liquide,"Ajoutez du pep's dans votre clearomiseur avec le Liquideo Po Po Pom 50ml ❤ .Avec sa saveur de pomme verte juteuse et pétillante, ce eliquide pomme Liquideo risque de ne plus quitter votre clearomiseur.",E-liquide Po Po Pom 50ml - Liquideo,https://www.evaps.fr/documents/media/images/contenu/e-liquide-po-po-pom-liquideo-50ml.jpg,19.90
117, Wismec,e_cigarette,,Predator 228 - Wismec,https://www.evaps.fr/documents/media/images/contenu/predator-228-wismec.jpg,59.90
173, Bio France,e_liquide,"Bio France vous propose, avec cet eliquide Dragon Rouge French Malaisien, un panier rempli de délicieux fruits frais du marché : des fruits rouges, des fruits du verger, des agrumes et des fruits exotiques juteux et savoureux.Cet e-liquide bio fruité de la gamme French Malaisien est fabriqué en France par la marque Bio France.",Dragon Rouge French Malaisien - Bio France,https://www.evaps.fr/documents/media/images/contenu/dragon-rouge-french-malaisien-bio-france.jpg,5.50
411, BomberTech,diy,Rechargez facilement vos box bottom feed avec le Reloader BF Refiller Bombertech ❤,Reloader - BomberTech,https://www.evaps.fr/documents/media/images/contenu/reloader-bombertech.jpg,14.90
275, Cloud Vapor,e_liquide,Réveillez vos papilles en douceur avec le eliquide Bean Crush 50ml ZHC Cloud Vapor ❤ .Ce délicieux e-liquide français café et vanille est un nectar enivrant et doux qui fera fondre vos papilles de plaisir.,Bean Crush 50ml - Cloud Vapor,https://www.evaps.fr/documents/media/images/contenu/bean-crush-cloud-vapor-50ml.jpg,17.90
108, Wismec,e_cigarette,,Coffret Sinuous P80 / Elabo Mini - Wismec,https://www.evaps.fr/documents/media/images/contenu/sinuous-p80-elabo-mini-wismec.jpg,62.90
58,Priv - Smoktech,e_cigarette,Le  Kit X-Priv 225W TFV12 Prince Smoktech ❤ est un mélange de design et de performance qui comblera à coup sûr de nombreux vapoteurs.,Kit X-Priv - Smoktech,https://www.evaps.fr/documents/media/images/contenu/kit-x-priv-smoktech.jpg,79.90
398, Tropika,diy,Le concentré Maldives Tropika ❤ vous procurera une sensation pétillante de saveurs avec son mélange de citron acidulé et sucré.,Arôme Maldives 10ml - Tropika,https://www.evaps.fr/documents/media/images/contenu/arome-maldives-tropika.jpg,5.90
113, Vaporesso,e_cigarette,,Kit Veco Solo - Vaporesso,https://www.evaps.fr/documents/media/images/contenu/kit-veco-solo-vaporesso.jpg,27.90
169, Bee,e_liquide,L'eliquide Citrius Bee vous plonge dans un bonheur acidulé au délicieux goût d'un citron vert qui se suffit à lui même. Cet e-liquide français citron vert ne laissera pas indifférent les vapoteurs amateurs d'agrumes !Le Citrius Bee 10ml Solevan est fabriqué en France par la marque Solevan.,Citrius 10ml - Bee,https://www.evaps.fr/documents/media/images/contenu/citrius-10ml-bee.jpg,5.90
49, Vaporesso,e_cigarette,"Le Kit Armour Pro Vaporesso ❤ est un élégant alliage, entre ▶ ergonomie ▶ puissance et ▶ technologies, que les amateurs de la marque vont adorer ❤",Kit Armour Pro 100W - Vaporesso,https://www.evaps.fr/documents/media/images/contenu/kit-armour-pro-vaporesso.jpg,64.90
99, Wismec,e_cigarette,,Coffret RX Gen3 - Wismec,https://www.evaps.fr/documents/media/images/contenu/rx-gen3-wismec.jpg,69.90
298,liquide American Mix 50ml - Liquideo,e_liquide,"American Mix Liquideo 50ml ❤ est un tabac blond américain, doux et subtil qui satisfera les amateurs de saveur tabac.",E-liquide American Mix 50ml - Liquideo,https://www.evaps.fr/documents/media/images/contenu/eliquide-american-mix-liquideo-50ml.jpg,19.90
240, Petit Nuage,e_liquide,"L'e liquide Petit Nuage Flocon Vanillé ❤ vous rappellera sans nul doute la fraîcheur d'un petit bonbon à la menthe sucré, mêlée à la douceur de la vanille ✔",Flocon Vanillé 60ml - Petit Nuage,https://www.evaps.fr/documents/media/images/contenu/flocon-vanille-petit-nuage.jpg,24.90
14, Geekvape,e_cigarette,Le kit Aegis Mini Geekvape ❤ est un coffret complet de cigarette électronique signé Geekvape.,Kit Aegis Mini - Geekvape,https://www.evaps.fr/documents/media/images/contenu/kit-aegis-mini-geekvape.jpg,59.90
124, Smoktech,e_cigarette,,Kit Alien Baby AL85 - Smoktech,https://www.evaps.fr/documents/media/images/contenu/kit-alien-baby-al85-smoktech.jpg,57.90
195,liquide Fraise Rhubarbe - So Fifty,e_liquide,Le Fraise Rhubarbe So Fifty ❤ est une nouvelle version du e-liquide du même nom fabriqué par Alfaliquid. Redécouvrez le délicat mariage d'une fraise sucrée et d'une rhubarbe pétillante avec cet e-liquide français Fraise Rhubarbe Alfaliquid composé de 50% de PG et 50 % de VG !,E-liquide Fraise Rhubarbe - So Fifty,https://www.evaps.fr/documents/media/images/contenu/fraise-rhubarbe-10ml-so-fifty.jpg,5.90
202, Les Déglingos,e_liquide,Le Eliquide Best Friends Les Déglingos ★ va vous faire goûter au plaisir d'un financier pâtissier à la framboise. Cette gourmandise fruitée intense est un parfait équilibre entre une pâtisserie moelleuse et un délicieux fruit sucré !,Best Friends 50ml - Les Déglingos,https://www.evaps.fr/documents/media/images/contenu/best-friends-les-deglingos.jpg,21.90
187, Avap,e_liquide,"Voyez la vie en bleu avec le e-liquide Blue Devil Avap ❤ une délicieuse mixture composée de framboise bleue, de cassis et de réglisse pour le plus grand bonheur de vos papilles curieuses.",Blue Devil - Avap,https://www.evaps.fr/documents/media/images/contenu/blue-devil-avap.jpg,5.90
24, Ijoy,e_cigarette,Le Kit iJoy Zenith 3 VV ✔ est un nouveau kit de e-cigarette performant et original signé iJoy.,Kit Zenith 3 VV - Ijoy,https://www.evaps.fr/documents/media/images/contenu/kit-zenith-3-ijoy.jpg,69.90
329, Greeneo,diy,Boostez vos recettes DIY en CBD avec le booster Greeneo CBD ★ Ajoutez celui-ci à vos préparations et obtenez un délicieux e-liquide DIY au CBD qui ne laissera pas vos sens indifférents.,Booster CBD - Greeneo,https://www.evaps.fr/documents/media/images/contenu/booster-cbd-greeneo.jpg,25.00
433, Hold Up,diy,Braquez votre clearomiseur avec le concentré Pig Doherty signé Hold Up © !,Concentré Pig Doherty - Hold Up,https://www.evaps.fr/documents/media/images/contenu/concentre-pig-doherty-hold-up.jpg,5.90
201, Les Déglingos,e_liquide,"Le eliquide Hell's Kitchen Les Déglingos ★ est une création savoureuse et originale, et vous propose de vaper une confiture sucrée et fondante, à base de fruits rouges fraîchement cueillis et d'une goyave tropicale intense...",Hell's Kitchen 50ml - Les Déglingos,https://www.evaps.fr/documents/media/images/contenu/hells-kitchen-les-deglingos.jpg,21.90
209, Furiosa Vapor,e_liquide,"Le Furiosa e liquide Lava Drops 40ml ❤ est un trésor de vapeur et de saveurs entre exotisme et jus frais revigorant, que vous allez adorer ✔",Lava Drops 40ml - Furiosa Vapor,https://www.evaps.fr/documents/media/images/contenu/lava-drops-furiosa.jpg,20.00
142, Joyetech,e_cigarette,,Kit eGo One V2 XL - Joyetech,https://www.evaps.fr/documents/media/images/contenu/kit-ego-one-v2-xl-joyetech.jpg,36.90
440, Cloud Vapor,diy,"Succombez aux saveurs du Kasai, signé Cloud Vapor ©.",Concentré Kasai - Cloud Vapor,https://www.evaps.fr/documents/media/images/contenu/concentre-kasai-cloud-vapor.jpg,6.90
137, Hugo Vapor,e_cigarette,"Le Pathfinder V2 Hugo Vapor ✔ est un kit de vaporisateur électronique comprenant une batterie et un atomiseur herbe sèche.Fabriqué par Hugo Vapor, le vaporisateur herbe Pathfinder II est simple à utiliser. Il est équipé d'une batterie interne de 2200 mAh, promettant une autonomie allant jusqu'à 90 minutes.",Kit Pathfinder V2 - Hugo Vapor,https://www.evaps.fr/documents/media/images/contenu/kit-pathfinder-v2-vapor.jpg,29.90
405, Swag Juice,diy,Boostez votre clearomiseur avec l'arôme Tamarin Supreme Energy Swag Juice ❤,Concentré Tamarin 10ml - Swag Juice,https://www.evaps.fr/documents/media/images/contenu/concentre-tamarin-swag-juice.jpg,5.90
234, Riot Squad,e_liquide,Laissez vous tenter par les douces saveurs d'orange et d'agrumes du e liquide Iron Bruise Riot Squad ❤,Iron Bruise 50ml - Riot Squad,https://www.evaps.fr/documents/media/images/contenu/iron-bruise-riot-squad.jpg,19.90
347, Divine,diy,L'arôme concentré Divine Roobarb Custard ❤ est une recette qui vient s'ajouter aux étonnants arômes DIY des britanniques de Chef's Flavour.,Concentré Roobarb Custard - Divine,https://www.evaps.fr/documents/media/images/contenu/concentre-roobarb.jpg,13.50
67, Smoktech,e_cigarette,Toute la puissance du Kit Stick Prince TFV12 signé Smoktech © dans votre poche !,Kit Stick Prince - Smoktech,https://www.evaps.fr/documents/media/images/contenu/kit-stick-prince-smoktech.jpg,41.90
313, Silverline Capella,diy,Succombez à la gourmandise de l'arôme Candied Watermelon Silverline Capella ❤ un délicieux concentré fruité 13ml ➤ reproduisant un bonbon à la pastèque bien sucré.,Arôme Candied Watermelon - Silverline Capella,https://www.evaps.fr/documents/media/images/contenu/arome-candied-watermelon-silverline-capella.jpg,3.90
70, Eleaf,e_cigarette,"Le kit Istick Kiya par Eleaf est le kit idéal pour les débutants faisant un premier pas dans la cigarette électronique ❤ Compacte et ergonomique, l'Istick Kiya se faufilera dans toutes les mains.",Kit Istick Kiya GS Juni - Eleaf,https://www.evaps.fr/documents/media/images/contenu/kit-istick-kiya-eleaf.jpg,48.90
362, Maw,diy,"Avec le concentré Maw Lee Revolute ❤ donnez de l'exotisme à votre clearomiseur.  Savant mélange frais de framboise et de litchi, l'arôme Lee Maw donnera à vos nuages un air de vacances.",Arôme Lee - Maw,https://www.evaps.fr/documents/media/images/contenu/arome-lee-maw.jpg,5.20
196,liquide Fruits Rouges - So Fifty,e_liquide,Le Fruits Rouges So Fifty ❤ est une nouvelle version du e-liquide du même nom fabriqué par Alfaliquid. Redécouvrez la fabuleuse combinaison fruitée de cet e-liquide Fruits Rouges Alfaliquid avec sa nouvelle composition en 50% de PG et 50 % de VG !,E-liquide Fruits Rouges - So Fifty,https://www.evaps.fr/documents/media/images/contenu/fruits-rouges-10ml-so-fifty.jpg,5.90
238, Aqua,e_liquide,"Explorez de nouveaux horizons avec le e liquide Oasis Ice Aqua ❤ savoureux et complexe mélange alliant une pêche juteuse à un melon sucré, accompagné de papaye et harmonisé avec un menthol rafraîchissant.",Oasis Ice 50ml - Aqua,https://www.evaps.fr/documents/media/images/contenu/oasis-ice-aqua.jpg,19.90
260, Marie Jeanne ,e_liquide,"Le e liquide CBD Malana Full spectrum Marie Jeanne ❤ vous fera redécouvrir l'utilisation du CBD. Avec son extraction  inédite et totalement novatrice en full spectrum, ce e-liquide cbd français ✔ se montrera encore plus efficace que ses acolytes.",Malana CBD Full Spectrum - Marie Jeanne ,https://www.evaps.fr/documents/media/images/contenu/cbd-malana-marie-jeanne.jpg,18.90
311,liquide All Coil - Liquideo,e_liquide,"Préparez vos vacances avec le e liquide All Coil 10ml Liquideo ❤, une rencontre rafraîchissante d'une multitude de fruits savoureux, rafraîchis par une menthe fraîche intense. Ce Liquideo All Coil fruité vous réserve une belle aventure de saveurs.",E-liquide All Coil - Liquideo,https://www.evaps.fr/documents/media/images/contenu/e-liquide-all-coil-liquideo.jpg,4.90
159, Minimal,e_liquide,Voyez la vie en rouge avec le e liquide Badiane Rouge Minimal ❤ un succulent mix de fruits rouges harmonisé à la perfection avec une saveur subtile d'anis et de menthe.,Badiane Rouge - Minimal,https://www.evaps.fr/documents/media/images/contenu/badiane-rouge-minimal.jpg,6.90
401, Swag Juice,diy,Égayez votre clearomiseur avec l'arôme Marmoset Red Amazon Swag Juice Remix ❤,Concentré Marmoset 10ml - Swag Juice,https://www.evaps.fr/documents/media/images/contenu/concentre-marmoset-swag-juice.jpg,5.90
317, Halo,diy,"Le concentré Torque 56 Halo ❤ est la version concentrée du célèbre e-liquide Torque 56 de Halo. Il vous permettra de fabriquer votre eliquide avec ce goût mythique de tabac ""classic brun"", fort et intense : un des meilleurs aromes DIY tabac !L'arôme Torque 56 doit être mélangé à une base PG/VG, avec ou sans nicotine.",Arôme Torque 56 - Halo,https://www.evaps.fr/documents/media/images/contenu/arome-torque-56-halo.jpg,7.90
166, Bee,e_liquide,"L'eliquide Melony² Bee est une création fruitée, mélangeant avec harmonie un melon et une pastèque juteux à souhait. Cet e-liquide français au melon est une réussite qui plaira à un grand nombre de vapoteurs recherchant une vape désaltérante !Le Melony Bee 10ml Solevan est fabriqué en France par la marque Solevan.",Melony² 10ml - Bee,https://www.evaps.fr/documents/media/images/contenu/melony-10ml-bee.jpg,5.90
276, Avap,e_liquide,"Voyez la vape en rouge avec le e-liquide Avap 10ml Red Devil ❤. Un somptueux mélange, de fruits rouges bien sucrés accompagnés d'absinthe, fait du Red Devil 10ml Avap un eliquide des plus surprenant et envoûtant.",Red Devil 10ml - Avap,https://www.evaps.fr/documents/media/images/contenu/red-devil-10ml-avap.jpg,5.90
197,liquide Fraise Mûre - So Fifty,e_liquide,Le Fraise Mûre So Fifty ❤ est une nouvelle version du e-liquide du même nom fabriqué par Alfaliquid. Redécouvrez le plaisir fruité de cet e-liquide Fraise Mûre Alfaliquid avec sa nouvelle composition de 50% de PG et 50 % de VG !,E-liquide Fraise Mûre - So Fifty,https://www.evaps.fr/documents/media/images/contenu/fraise-mure-10ml-so-fifty.jpg,5.90
438, Ultimate,diy,Découvrez l'arôme Ifrit V2 de Ultimate © !,Concentré Ifrit V2 30 ml - Ultimate,https://www.evaps.fr/documents/media/images/contenu/ifrit-ultimate.jpg,13.90
322, Readiy,diy,"Le concentré Mangue Banane Readiy ❤ est un arôme d'origine française pour la fabrication de liquide pour cigarette électronique. Cet arôme Mangue Banane est un vrai bonheur fruité et original, mélangeant les délicieuses saveurs de ces fruits tropicaux.",Arôme Mangue Banane - Readiy,https://www.evaps.fr/documents/media/images/contenu/arome-mangue-banane-readiy.jpg,3.50
339, Dude's,diy,Le concentré Soursop Strawberry Dude's ❤ est un concentré aux saveurs exotiques qui saura surprendre et conquérir le cœur des vapoteurs ✔,Soursop Strawberry - Dude's,https://www.evaps.fr/documents/media/images/contenu/soursop-strawberry-dude-s.jpg,13.90
42, Vaporesso,e_cigarette,"Le Kit Vaporesso Cascade One Plus SE ❤ sera la cigarette électronique idéale ✔ pour vapoteur nomade ! Entre ▶ design et ▶ technologie, ce kit Vaporesso ne vous lâchera pas ✔",Kit Cascade One Plus SE - Vaporesso,https://www.evaps.fr/documents/media/images/contenu/kit-cascade-one-plus-se-vaporesso.jpg,45.90
